{
  "commits": [
    {
      "anchors": [
        {
          "diff": "diff --git a/file2.txt#L1-L3 b/file2.txt#L1-L3\nindex rk64:455e176970060f71..rk64:92ff30f36d208411\n--- a/file2.txt#L1-L3\n+++ b/file2.txt#L1-L3\n@@ -1,3 +1,3 @@\n-alpha\n-beta\n+ALPHA\n+BETA\n gamma\n",
          "path": "file2.txt#L1-L3"
        }
      ],
      "date": "2024-07-03T09:46:40+00:00",
      "hash": "3fb964b6a40fb2f24c68f604c27adf7412edd9db",
      "summary": "C2: edit file2 content only"
    },
    {
      "anchors": [
        {
          "content": "line1\nline2\nline3\nline4\nline5\n",
          "path": "file1.txt#L1-L5"
        },
        {
          "content": "alpha\nbeta\ngamma\n",
          "path": "file2.txt#L1-L3"
        }
      ],
      "date": "2024-07-03T09:46:40+00:00",
      "hash": "3a4f2aec7f44bf283e67571e8fc5a937254efd41",
      "span_diff": "diff --git a/.span/h b/.span/h\nnew file mode 100644\nindex 0000000..3cc03ef\n--- /dev/null\n+++ b/.span/h\n@@ -0,0 +1,4 @@\n+file1.txt#L1-L5 rk64:bb2a1e4032115e1c\n+file2.txt#L1-L3 rk64:455e176970060f71\n+\n+First why: tracks the two source files.\n",
      "summary": "C1: create span"
    }
  ],
  "current": {
    "anchors": [
      {
        "content": "ALPHA\nBETA\ngamma\n",
        "diff": "diff --git a/file2.txt#L1-L3 b/file2.txt#L1-L3\ndrift source head\nindex rk64:455e176970060f71..rk64:92ff30f36d208411\n--- a/file2.txt#L1-L3\n+++ b/file2.txt#L1-L3\n@@ -1,3 +1,3 @@\n-alpha\n-beta\n+ALPHA\n+BETA\n gamma\n",
        "path": "file2.txt#L1-L3",
        "sources": [
          "HEAD"
        ]
      }
    ]
  },
  "schema_version": 2,
  "span": "h"
}
